{
  "schema_version": 1,
  "evidence_revision": "P2-20A.5",
  "captured_utc": "2026-08-29T06:56:43.4049825+00:00",
  "task_id": "P2-20A",
  "criterion_id": "G2-06",
  "source_build": "qy-3.0.0.413",
  "result": "BLOCKED",
  "review_execution_result": "PASS",
  "task_status": "BLOCKED",
  "completion_criteria_satisfied": false,
  "diagnostic_scope_complete": true,
  "scope_complete": false,
  "g2_06_satisfied": false,
  "p3_authorized": false,
  "input_bindings": {
    "aggregate_sha256": "dec065493be8b1de201494ff47d41772c911134dd361f66d34f52969e4430973",
    "entries": [
      {
        "role": "auxiliary_inventory",
        "sha256": "ce440d346053144eae53dead5c2e8fef97c674db211ee8b861baedd17a9daaff"
      },
      {
        "role": "three_layer_inventory",
        "sha256": "c399bfc3db6c516be3165750de96f705452c631e14c6ae10530325ea576ef876"
      },
      {
        "role": "lexical_report",
        "sha256": "a81be00b5ca6ba2a6030f5a1a0537d361ad929ba342569a74091ccf9bfd07935"
      },
      {
        "role": "package_inventory",
        "sha256": "ac6671219c41324f1e7aac0a1cd5c08a9dc66f7c75e30cd3081610c038a26d16"
      },
      {
        "role": "asset_inventory",
        "sha256": "f3c2bac9fd0cf3415537011f7a2211e6cf6a603c1cde462cb93a3175fab2871a"
      },
      {
        "role": "reference_closure",
        "sha256": "7bf5803b5fa22e1dad39a30fb6d2e953c476b9ce214e53f8140f1e977c6535ef"
      },
      {
        "role": "policy",
        "sha256": "d2f46783f3038fe5b7a802e04751d70dde83b03c740d718ca373d27d73ff328c"
      },
      {
        "role": "schema",
        "sha256": "88fb488068887b19d68594a8dbca03580a752477c604565f5985e36ff4e1b346"
      }
    ],
    "legacy_sources": [
      {
        "role": "encrypted_config_reader",
        "sha256": "f1bef9a8221f2e05bdf855d7038d71f9222792a349f8e29944651cbddf0c4042"
      },
      {
        "role": "line_and_pair_parser",
        "sha256": "bab39ccce47907e06dbac0913c2edf2b43350a7efae867cb8b9c61fb56880314"
      },
      {
        "role": "object_and_package_resolver",
        "sha256": "1f10ae3b06062564ac283a9396b1d232c261c669bcd6c22271b414aa6d6323e5"
      },
      {
        "role": "reflection_config_loader",
        "sha256": "3a4ba187ea1099706328c0b49084ad555fa3d2f68f16d8b8e7f0a53fa0b8fc57"
      },
      {
        "role": "region_consumer",
        "sha256": "a1e5d33643d633234b2eeb07c6dc9358814d9802d4a9f43c959c1a4b155f1853"
      },
      {
        "role": "typed_property_importers",
        "sha256": "b92a93ba136e1de845b5c5f6d385fad3904db202b7396f213a3749a2e4584a57"
      }
    ]
  },
  "measured": {
    "file_instances": 212,
    "source_instances_verified": 212,
    "region_strict_instances": 135,
    "region_semantic_references": {
      "unique_total": 3180,
      "unique_file": 3042,
      "unique_object": 4,
      "unique_package_root": 134,
      "ambiguous_object": 211,
      "ambiguous_object_candidate_edges": 422,
      "ambiguous_object_divergent_bodies": 211,
      "unresolved_resource": 1,
      "first_candidate_selections": 0
    },
    "ecf": {
      "instances": 64,
      "mixed_newline_differences": 3,
      "legacy_assignments_missed_by_a3_parser": 4,
      "runtime_with_candidates": 15,
      "runtime_without_candidates": 21,
      "editor_without_candidates": 28
    },
    "parsed_shared_help_zero_lexical": 7,
    "malformed_instances": 6
  },
  "parser_and_consumer_controls": {
    "strict_region_xml": true,
    "consumer_selected_fields_only": true,
    "legacy_ecf_crlf_parser_compared": true,
    "mixed_newline_difference_is_blocking": true,
    "first_candidate_selection": false,
    "zero_match_is_no_reference": false,
    "shadow_without_roots_is_no_reference": false,
    "malformed_auto_fix": false,
    "unknown_field_is_ignored": false
  },
  "semantic_state": {
    "approved_consumer_contracts": 0,
    "approved_no_reference_instances": 0,
    "approved_roots": 0,
    "terminal_instances": 0,
    "nonterminal_instances": 212,
    "ordinary_development_authorization_is_semantic_approval": false
  },
  "blockers": [
    {
      "reason_code": "AMBIGUOUS_OBJECT_TARGETS",
      "count": 211
    },
    {
      "reason_code": "UNRESOLVED_RESOURCE_TARGETS",
      "count": 1
    },
    {
      "reason_code": "LEGACY_PARSER_PARITY_GAPS",
      "count": 3
    },
    {
      "reason_code": "MALFORMED_INPUTS_UNDISPOSED",
      "count": 6
    },
    {
      "reason_code": "APPROVED_ROOT_SET_EMPTY",
      "count": 0
    },
    {
      "reason_code": "CONSUMER_CONTRACTS_UNAPPROVED",
      "count": 212
    }
  ],
  "negative_contracts": [
    "MIXED_NEWLINE_PARSER_DRIFT_REJECTED",
    "FIRST_CANDIDATE_SELECTION_REJECTED",
    "ZERO_MATCH_IS_NO_REFERENCE_REJECTED",
    "SHADOW_WITHOUT_ROOTS_REJECTED",
    "MALFORMED_AUTO_FIX_REJECTED",
    "UNKNOWN_FIELD_REJECTED"
  ],
  "g2_projection": {
    "criteria_total": 9,
    "satisfied": 7,
    "blocked": 2,
    "g2_decision": "BLOCKED"
  },
  "contracts": {
    "policy_sha256": "d2f46783f3038fe5b7a802e04751d70dde83b03c740d718ca373d27d73ff328c",
    "schema_sha256": "88fb488068887b19d68594a8dbca03580a752477c604565f5985e36ff4e1b346"
  },
  "disclosure": {
    "anonymous_aggregate_and_hash_only": true,
    "raw_values": false,
    "key_names": false,
    "file_names": false,
    "private_source_paths": false,
    "source_line_numbers": false,
    "legacy_source_lines": false,
    "exact_primary_keys": false,
    "decoded_payloads": false
  }
}
